{
  "$schema": "https://json-schema.org/draft/2020-12/schema",
  "$id": "https://xq.example.invalid/schemas/signer-policy.schema.json",
  "type": "object", "additionalProperties": false,
  "required": ["schemaVersion", "approvedRepository", "releaseInput", "installerVerification", "licenseVerification", "unknownStateAction"],
  "properties": {
    "schemaVersion": { "const": 1 },
    "approvedRepository": { "type": "object", "additionalProperties": false, "required": ["owner", "name", "repositoryId"], "properties": { "owner": { "const": "openclaw" }, "name": { "const": "openclaw-windows-node" }, "repositoryId": { "const": 1144728715 } } },
    "releaseInput": { "type": "object", "additionalProperties": false, "required": ["approvedLockRequired", "allowLatestAlias", "draftAllowed", "prereleaseAllowed"], "properties": { "approvedLockRequired": { "const": true }, "allowLatestAlias": { "const": false }, "draftAllowed": { "const": false }, "prereleaseAllowed": { "const": false } } },
    "installerVerification": { "type": "object", "additionalProperties": false, "required": ["lockHashRequired", "githubAssetDigestRequired", "authenticodeStatus", "lockSubjectRequired", "lockThumbprintRequired", "timestampRequired", "chainRequired"], "properties": { "lockHashRequired": { "const": true }, "githubAssetDigestRequired": { "const": true }, "authenticodeStatus": { "const": "Valid" }, "lockSubjectRequired": { "const": true }, "lockThumbprintRequired": { "const": true }, "timestampRequired": { "const": true }, "chainRequired": { "const": true } } },
    "licenseVerification": { "type": "object", "additionalProperties": false, "required": ["fixedCommitRequired", "files", "apiLicenseMetadataIsSufficient"], "properties": { "fixedCommitRequired": { "const": true }, "files": { "const": ["LICENSE", "src/OpenClaw.Tray.WinUI/THIRD_PARTY_NOTICES.md"] }, "apiLicenseMetadataIsSufficient": { "const": false } } },
    "unknownStateAction": { "const": "block-release" }
  }
}
