{
  "schemaVersion": 1,
  "approvedRepository": { "owner": "openclaw", "name": "openclaw-windows-node", "repositoryId": 1144728715 },
  "releaseInput": { "approvedLockRequired": true, "allowLatestAlias": false, "draftAllowed": false, "prereleaseAllowed": false },
  "installerVerification": { "lockHashRequired": true, "githubAssetDigestRequired": true, "authenticodeStatus": "Valid", "lockSubjectRequired": true, "lockThumbprintRequired": true, "timestampRequired": true, "chainRequired": true },
  "licenseVerification": { "fixedCommitRequired": true, "files": ["LICENSE", "src/OpenClaw.Tray.WinUI/THIRD_PARTY_NOTICES.md"], "apiLicenseMetadataIsSufficient": false },
  "unknownStateAction": "block-release"
}
